title,text,subject,date,link
"Laupäeval on rahvusvaheline ""mitte midagi ostmise"" päev | Telegram","Rahvusvaheline ostuvaba päev on 1992. aastast tähistatav liigtarbimise vastane protestipäev, millega kutsutakse inimesi üles vähem tarbima, analüüsima oma tarbimisharjumusi ning suurte poekettide asemel kohalikke väikepoode toetama. Ostuvaba päev toimub Euroopas novembri viimasel laupäeval ja USA-s tänupühale (novembri neljas neljapäev) järgneval reedel.  Lisaks enda tarbimise vähendamisele korraldatakse üle kogu maailma inimeste teadlikkuse suurendamiseks mõeldud üritusi, aktsioone ja töötubasid.    Esimene ostuvaba päev toimus 1992. aasta septembris Kanadas, et pöörata ühiskonna tähelepanu tarbimise ja ületarbimise tagajärgedele. Info selle idee kohta liikus kiiresti inimeste ja interneti kaudu edasi ning 1997. aastast hakati ostuvaba päeva tähistama tänupühale järgneval reedel, vastukaaluks tarbimisele pühendatud mustale reedele, mil suured poeketid pakuvad öist poodlemisvõimalust, allahindlusi ning võimalust soetada varakult jõulukinke. Tänapäeval on must reede Ameerikas nii populaarne, et klientidel on tavaks telkida poodide uste ees ning hullunud poodlejate massides saadud vigastused on tavaline nähtus. Ostuvaba päevaga sooviti jõulud muuta taas südamlikuks pühaks, et need poleks korporatsioonide hiigelkasumi teenimise tööriistaks. Ostuvaba päev sai tuule tiibadesse tänu ajakirja Adbusters toetusele, mis üritas 2000. aastal üritust televisioonis reklaamida. Paraku keeldusid kõik suuremad USA telekanalid tarbimisvastase reklaami näitamisest ja näiteks CBS-i esindaja ütles ajakirjale, et selline reklaam on vastuolus USA majanduspoliitikaga. Lõpuks nõustus CNN reklaami näitama, kuid üksnes pärast seda, kui neile öeldi, et keeldumise puhul kirjutatakse sellest artikkel Wall Street Journalisse. Nüüdseks on info ostuvabast päevast interneti abiga levinud üle kogu maailma ning tarbimisvastast päeva tähistatakse ligi 70 riigis. Eestis tähistati ostuvaba päeva esmakordselt 2002. aastal. Idee algatajate sõnul ei ole ostuvaba päeva mõte see, et inimene ei käi üks päev poes, vaid see, et tarbijad mõtleksid hoolega oma valikute üle ning võtaks seda esimese sammuna keskkonnasäästlikuma eluviisi poole. Samuti on see asjakohaseks võimaluseks tutvuda kohalike poepidajatega ning korraldada kaubavahetuse põhimõttel töötavaid jõululaatasid: inimesed toovad laadale kinke, mida nad ei vaja ning saavad vastutasuks võtta kellegi teise toodud eseme. Paljudes riikides korraldatakse tarbimiskäitumise tagajärgedele tähelepanu pööramiseks mitmesuguseid aktsioone, näiteks lõigatakse supermarketites katki krediitkaarte, sõidetakse tühjade kärudega ühtses rivis mööda poodi, jalutatakse poodides zombidena ja korraldatakse suuri tänavapidusid. Samuti toimuvad töötoad, kus õpetatakse muu hulgas ka ise jõulukingitusi tegema. Üksikisiku tasandil saame me kõik teha selle otsuse, et tänavu mõttetuid jõulukinke kokku ei osta ja alustada keskkonnasäästlikumat tarbimist ning kutsuda üles ka teisi oma tarbimiskäitumist muutma.   Allikad: Adbusters, The Guardian, International Business Times, Buy Nothing Day UK Käesolev artikkel ilmus meil algselt 2014. aasta 28. novembril. Foto: breathenetwork.org   Toimetas Annika Urvela   PS. Telegram tegutseb tänu lugejate abile. Kui sinu arvates on Telegramis ilmuv info vajalik ja oluline, võid soovi ja võimaluse korral meid toetada. Suur aitäh kõigile, kes aitavad olulisi teemasid pildis hoida! Unlimited MTÜ EE497700771002818684 BITCOIN 1Hqjxbt8czHcENjDQan5GFL3Qssn4znpAr DASH XjUJswujDzLgSgg7Ly8bK6TEo1kwVzaKeV BITCOIN CASH (BCH) qp0gdarh8xtte8fygj2ehrud7h4gsugzeqlmamcx3s ETHEREUM 0x9b67438a7a4cdd88edb14c2880e920a3cba692c6",Telegram,2018-11-22T09:18:34+02:00,https://www.telegram.ee/maailm/laupaeval-on-rahvusvaheline-ostuvaba-paev
Riigikogu majanduskomisjoni liige Kai Rimmel: Eesti Post tuleks jagada kaheks ettevõtteks - Uued Uudised,"Eesti Post tuleks jagada kaheks ettevõtteks, millest üks läheks erakätesse ja teisest saaks teenindusplatvorm, mille kaudu saab kodanikele vajalikke teenuseid ja kaupu üle Eesti, kirjutab Riigikogu liige Kai Rimmel (EKRE).  Tänaseks on selgeks saanud, et Eesti Posti (EP) senine majandamismudel ei ole jätkusuutlik. Selle üheks tulemuseks on, et mõne aastaga on rahahädas EP võtnud maha ligi tuhat kirjakasti ehk pea pooled. Peamiselt maakohtadest. Ja neidki, mis alles, tühjendatakse harvemini. Samas on Eesti inimestele eluliselt oluline, et EP oleks kliendisõbralik, tõhus ja respekteeritud ettevõte. Seega vajab kogu EP majandamismudel muutmist. Universaalse postiteenuse (UPT) osutamine on riigi kohustus – Ülemaailmsesse Postiliitu kuuluvatena (sh. Eesti) lepivad omavahelisi tingimusi kokku riigid, mitte postiettevõtted. EP tänase majandusmudeli dilemma on lihtne – kokku on pandud strateegiliselt kasumisuunal toimiv pakiäri ja kahjumisuunal toimiv postiteenuste äri. Seni on eeldatud, et need kaks tasakaalustavad teineteist ja seeläbi leiab EP juhatus majanduslikult jätkusuutliku sünteesmudeli. Paraku ei ole see õnnestunud ja seda mitte ainult subjektiivsetel põhjustel. Tänu tehtud investeeringutele on EP-l tänaseks hea positsioon klientidele pakkide kättetoimetamisel ja seal edaspidiselt kasumi suurendamisel. Samas – EP võitis eelmisel aastal universaalse postiteenuse konkursil ainukese osalejana (kas ikka konkursil, kuna konkurente polnud?) riigipoolse pakkumise, millesse oli suur miinus juba sisse kirjutatud. Sellistel tingimustel “konkursi” korraldamist ei saa nimetada omanikupoolseks strateegiliseks suunamiseks. UPT võib EP-le aastatel 2019-2024 tuua kokku 40 miljonit eurot kahjumit. Valida on kahe majandamismudeli vahel – kas jätkata senisega, seades seejuures üheks eesmärgiks postiteenuste sektori maksimaalse efektiivistamise, või teha EP-st eraldi riigitellimusel sihtfinantseeritud ettevõte ja müüa Omniva vabaturu äridena, näiteks börsile viimisega. Seda pooldavad Isamaa poliitik Sven Sester ja valdkonnaga töiselt kokku puutunud ekspoliitik Meelis Atonen (Äripäev, 25.11.2020). Samas on poliitiline kartus, et pakiäri erastamine võib viia riigi jaoks UPT kulu kõrgustesse ning see kulu jääks eelarvet painama pikka aega. Seetõttu on ka arvamusi, et EP postiteenuse ja pakiäri võiks ühendada ühtseks teenuseks ning jätta ainult e-arve äri tütarettevõtteks Omniva kaubamärgi alla. Ettevõtluse taustaga poliitikuna pooldan tänase EP restruktureerimist kaheks ettevõtteks. Kas saaksime näiteks ette kujutada diivaneid tootvat tehast, kus osa mudeleid on küll tarbijasõbralikud, kuid milledele kehtivad regulatsioonid ei tee neid turukõlbulikuks ja nende müügikahjum tuleb kohustuslikus korras katta teiste mudelite tootmisega? Paraku tänane seis EP-s just selline ongi. Kus tururegulatsiooni toime ei ole ühiskondlikult vastuvõetav, nagu täna UPT puhul näeme, seal tuleb kehtestada riiklik kuluregulatsiooni mehhanism, mis rakenduks EP postiteenuste (mis siis ei saa enam kanda nimetust “postiäri”) jaoks loodavale riiklikule sihtasutusele SA Eesti Postiteenused. Eeldused, et riigile ei hakka ka peale Omniva erastamist langema äraarvamatu finantskoorem, on olemas. Tuleviku EP võiks olla teenindusplatvorm, mille kaudu saab lisaks postiteenustele ka muid kodanikele vajalikke teenuseid ning kaupu üle Eesti. Teenuskanalid digitaliseeruvad ka postiteenuste valdkonnas, vähendades nõudlust traditsioonilise postkontori järgi. Inimene tuleb postkontorisse kas alternatiivide puudumise või teenuse keerukuse tõttu. Postkontoris osutatavatele teenustele on aga tihtipeale olemas alternatiiv. Täisfunktsionaalsed postkontorid peaksid seetõttu jääma suurematesse kogukondadesse, kus eesmärgiks oleks nende optimaalne jaotus nõudlusele vastavalt. Seejuures tuleb kulude optimeerimise esimese sammuna hinnata eelkõige hajaasustuse piirkondades elavate inimeste liikumismarsruute eesmärgiga leida postiteenuste osutamisel sünergiat juba loodud infrastruktuuri raames, mida inimesed nagunii külastavad (näit. COOP-i jt. maakaupluste võrk). Minu isiklik arvamus ja ettepanekud: 1. EP viib läbi struktuursed muudatused (võrk eraldi äriks), vaatab üle teenused, kulumudeli ja teostab jõukohased infotehnoloogilised ja logistilised arendused vähendamaks kulusid. 2. Vaadatakse üle õigusaktide muutmise vajadus (MKM ministri määrused) ja otsustatakse postiteenustele esitatavad kvaliteedinõuded koosmõjus omaniku ootustega. Vaadatakse üle Postiseaduse põhimõtted, sh. UPT hinnaregulatsiooni viimine MKM-i pädevusest Konkurentsiameti pädevusse analoogselt elektri, gaasi ja vee regulatsioonidega. 3. Algatatakse Postiseaduse muutmise seaduse eelnõu väljatöötamine. Kai RimmelRiigikogu majanduskomisjoni liige  ",Uued Uudised,2020-12-1,https://uueduudised.ee/arvamus/riigikogu-majanduskomisjoni-liige-kai-rimmel-eesti-post-tuleks-jagada-kaheks-ettevotteks/
Itaalia politsei purustas inimkaubitsejate võrgu - Uued Uudised,"Itaalia politsei purustas laupäeval inimkaubitsejate võrgu, mis toimetas migrante Afganistanist, Iraagist, Iraanist ja Pakistanist Itaaliasse ja sealt edasi Põhja-Euroopasse.Kinni peeti 19 kahtlusalust. Catania prokuratuuri juhtimisel läbi viidud juurdluse tulemusena avastati võrgustik, mis rentis või varastas paate, et tuua nendega migrante Türgi ja Kreeka kaudu Itaaliasse. Osa reisis edasi Itaalia põhjapiirile, kust nad smugeldati autodes üle piiri Prantsusmaale.Kinnipeetute hulgas on Iraagi kurde, afgaane ja itaallasi, ütles politsei. Üks võrgustiku baase asus Itaalia lõunaosas Baris, kus väljastati võltsdokumente, mis näitasid migrantidel elamisloa saamiseks kohustusliku eluaseme olemasolu. Ülejäänud baasid olid Itaalia põhjaosas Milanos ja Torinos, aga ka Prantsusmaa piiril asuvas Ventimiglia linnas. Osa kinnipeetuist aitas varustada põgenikke võltsitud töölepingutega, et nood saaksid taotleda elamisluba Itaalias, märkisid võimud. Juurdlus algas 2018. aastal, kui Sitsiilia Syracuse linna lähedal maabus 10 paati, mis olid saabunud Türgist ja Kreekast, mitte Liiibüast, kust juba aastaid asub teele valdav enamus Itaaliasse suunduvaid põgenikke. Uurimine tõi päevavalgele võrgustiku, mis koosnes itaallastest ja välismaalastest, kellest enamusel oli rahvusvahelise kaitse alusel välja antud elamisload. Jõuk aitas korraldada Iraanist, Iraagist, Pakistanist ja Afganistanist pärit migrantide sisenemist, viibimist ja transiiti Põhja-Euroopasse. Üks kahtlusalustest tegeles põgenike transportimisega Ventimiglia raudteejaamast Prantsusmaale. Sitsiiliasse seilanud aluste kipritele maksti ühe üleveo eest umbes 800 eurot, samas kui migrandid maksid igaüks umbes 6000 eurot enda smugeldamise eest Aasiast Kreeka ja Türgi kaudu Itaaliasse, märkis politsei. Itaalias võimude tabatud smugeldajate jõuk oli seotud kuritegelike rühmitustega Türgis ja Kreekas. Uute Uudiste toimetus lisab, et purustati vaid osa võrgustikust – ülejäänud osa ehk Itaalia vasakvalitsus, Saksamaa vabaühendused ja Euroopa Komisjon jäid puutumata, sest tänu neile inimkaubandus üldse toimibki. (AFP-BNS-UU) ",Uued Uudised,2020-12-5,https://uueduudised.ee/uudis/maailm/itaalia-politsei-purustas-inimkaubitsejate-vorgu/
President Trump otsustas USA eriüksuste baasi Riiga rajada - Uued Uudised,"USA Euroopa eriüksuste pressiesindaja kolonelleitnant Juan Martinez teatas, et Riiga kavandavasse baasi kuuluvad sõidukite hooldus töökojad, laskemoona laod ja kaks helikopterite maandumise rada USA 352 Eriüksuste Lennu Diviisi (Special Operations Wing) CV-22 Osprey (kalakotkas) pöördrootoriga lennukite jaoks. Esialgselt on uue baasi loomise eelarves 3,7 miljonit dollarit. Selle baasi otstarve on kolonelleitnant Martinezi sõnutsi hõlbustada eriüksuste kiiret saabumist ja liikumist Balti riikide operatsioonialal ja hoolitseda varustuse eest. Baasi asutamine on osa president Trumpi USA vägede ümberpaigutamisest Euroopas, et ära hoida Venemaa Balti riikide vastu suunatud agressiooni. Viimase viie aasta jooksul on USA kulutanud sadu miljoneid dollareid Ida-Euroopa kaitse tugevdamiseks. 10,8 miljonit sellest on kulutatud Ämari lennuvälja väljaehitamiseks. Ämari lennuvälja saab nüüd kasutada USA ja NATO lennuüksuste tegutsemiseks ja vajaduse korral lahinglendudeks. Lätti on kavas veel üks baas asutada, mis annaks võimaluse suuremal hulgal varustust ja lahingüksusi tuua Balti riikidesse niihästi manöövriteks ja õppusteks kui kriisi olukordade likvideerimiseks. Fakt, et USA on viimaste aastate jooksul panustanud NATO idapiiri, st Balti riikide, Poola, Rumeenia ja teiste Ida-Euroopa riikide kaitseks selle asemel, et üksusi pelgalt Saksamaal hoida, annab meile lootust, et NATO lepingu viies, nn „üks kõigi, kõik ühe eest“ lõik on üha enam muutumas ka Eestile tõeliseks kaitsekilbiks.  USA CV22 Osprey (kalakotkas) on pöördrootoriga lennuk. Ta on võimeline helikopteri moodi õhku tõusma ja seejärel lendama propelleritega lennukina. Kasutatakse peamiselt eriüksuste transpordiks ja toetuseks. Relvastuseks on 50-kaliibriline kuulipilduja. Võimeline transportima 32 sõdurit ehk 4,5 tonni varustust. Üks CV22 maksab umbes 90 miljonit dollarit. Jüri Toomepuu  ",Uued Uudised,2020-12-5,https://uueduudised.ee/uudis/maailm/president-trump-otsustas-usa-eriuksuste-baasi-riiga-rajada/
Põlissoomlased tõusid taas oma maa populaarseimaks parteiks - Uued Uudised,"Soome ringhäälingu Yle viimase küsitluse kohaselt läksid Põlissoomlased taas mööda peaminister Sanna Marini sotsiaaldemokraatidest – neid toetab 20,9 ja vasapoolseid 20,6 protsenti valijatest. Uuringu tulemused näitavad pandeemia eelse olukorra taastumist, kui populaarseim erakond oli pikka aega Põlissoomlaste partei, vahendab ERR Ylet. Koroona levides kasvas võimuparteide populaarsus paljudes Euroopa riikides. Novembris tõusis toetus Põlissoomlastele 1,4 protsendipunkti võrra ning nende praegune 20,9-protsendine toetus on selle aasta kõrgeim. Põlissoomlased on suutnud oma senist toetajaskonda hoida ning suurendanud seda Koonderakonna (Kokoomus) ja Keskerakonna (Keskusta) arvel, ütles küsitluse läbi viinud Taolustutkimuse uuringujuht Tuomo Turja. ",Uued Uudised,2020-12-4,https://uueduudised.ee/uudis/maailm/polissoomlased-tousid-taas-oma-maa-populaarseimaks-parteiks/
Pühasõdalased ründasid Malis rahvusvaheliste vägede baase. Eesti kaitseminister pole kommenteerinud - Uued Uudised,"Pühasõdalased ründasid esmaspäeval Mali põhjaosa kolmes linnas üheaegselt sõjaväebaase, kus baseeruvad rahvusvahelised väed, teatasid kohalikud elanikud ja ÜRO ametiisik. Kuigi Eesti üksus asub Gaos, mis sattus pühasõdalaste rünnaku alla, pole Eesti kaitseministeerium olukorda kommenteerinud. 2019. aasta juulis said Gaos viga kuus Eesti kaitseväelast.  Tundmatuks jääda soovinud ÜRO ametiisik kinnitas rünnakuid kolmes linnas ning ütles, et hommikul tabasid Kidalis asuvat baasi raketid ning samaaegselt toimusid rünnakud ka Gaos ja Menakas. Selline koordineeritud rünnak rahvusvahelistele vägedele on harvaesinev. Mali sõjaväeallika sõnul inimohvreid ei olnud, küll aga tekitasid rünnakud materiaalset kahju.Kidalis oli baasi poolt, kus asuvad ÜRO rahuväed ja Prantsusmaa operatsioonis Barkhane osalevad üksused, kuulda üle kümne plahvatuse. Baasi julgeolekutöötaja sõnul sõitis koidu eel enne raketi- ja kuulipildujatule algust ümber laagri salk mootorrattureid. Mali on silmitsi islamimässulistega, kes algul kinnitasid kanda riigi põhjaosas, aga nüüdseks on levinud ka Mali keskossa ja sealt edasi Burkina Fasosse ning Nigerisse. Prantsusmaa rahukaitsejõududel on Saheli piirkonnas umbes 5000 sõjaväelast, kes osalevad džihadistide vastases operatsioonis Barkhane, lisaks on Malis 1000 ÜRO rahuvalvajat. Lisaks sellele on Euroopa kohal Takuba sihtüksusega, mis nõustab ja toetab Mali vägesid. “Terroristid üritasid Gaos, Menakas ja Kidalis ebaõnnestunult koordineeritud rünnakut Barkhane, ÜRO rahuvalvajate ja Euroopa üksuse Takuba baasidele,” kinnitas rahvusvaheliste jõudude sõjaväeametnik. “Olukord on kontrolli all.” Takuba peaksid tähendama ka eestlasi. Postimees, 16. juuli 2020: Eesti erioperatsioonide väejuhatuse kaitseväelaste üksus alustas sel nädalal teenistust Malis operatsioonil Takuba. Suur osa Mali territooriumist on väljaspool valitsuse kontrolli. Riigis on tapetud tuhandeid sõdureid ja tsiviilisikuid ning sajad tuhanded on oma kodudest põgenenud. Sageli õhutavad võitlust etnilised pinged. Eesti saatmisel Malisse rõhutati, et see aitab ära hoida massimigratsiooni Euroopasse ja inimkaubandust, need nähtused aga on vaid teravnenud. Lisaks pole Malis ka pärast sel aastal toimunud sõjaväelist riigipööret seaduslikku valitsust. (AFP-BNS-UU) ",Uued Uudised,2020-11-30,https://uueduudised.ee/uudis/maailm/puhasodalased-rundasid-malis-rahvusvaheliste-vagede-baase-eesti-kaitseminister-pole-kommenteerinud/
Migrante lahkelt enda maale lubavad Lõuna-Euroopa riigid nõuavad endiselt rändekvoote - Uued Uudised,"Kuigi Itaalia endine siseminister Matteo Salvini tõestas, et ebaseaduslikule rändele saab piiri panna, lasevad Lõuna-Euroopa riigid neid endiselt sisse – ja siis virisevad, et ei saa hakkama. Euroopa Liidu lõunapoolsed riigid, kuhu saabub kõige enam pagulasi, leiavad, et Euroopa Liidu uus rände- ja varjupaigalepe ei jaga neile osaks saavat koormust piisavalt, samas aga jätkavad nad migrantide kokkukorjamist. Kreeka, Itaalia, Malta ja Hispaania leiavad AFP ja Associated Pressinini jõudnud ühisseisukohas, et “solidaarsusmehhanism on endiselt keeruline ja ebamäärane”. 27 liikmesriiki peaksid nende arvates rändekoormust omavahel kvootide alusel jagama, ehkki paljud riigid nagu Austria, Tšehhi Vabariik, Ungari, Poola, Slovakkia jt pole sellega nõus. “Eesliiniriigid ei saa vastu seista kogu Euroopa Liidule suunatud rändesurvele,” seisab memorandumis, mis saadeti Euroopa Komisjoni juhile Ursula von der Leyenile, Euroopa Ülemkogu alalisele eesistujale Charles Michelile ja EL-i eesistujariigi Saksamaa kantslerile Angela Merkelile. Tegelikult pole rändesurve sugugi kogu Euroopale suunatud, vaid soovitakse nendesse rikastesse maadesse, kes on võõraid kutsunud – Saksamaa, Rootsi, Suurbritannia, Soome ja mitmed teised Lääne-Euroopa maad. Enam kui miljoni migrandi saabumine 2015. aastal tekitas poliitilise kriisi ja andis surmahoobi Euroopa senisele varjupaigasüsteemile. Tüli selle pärast, kes peaks saabuvate migrantidega tegelema, on rändeküsimusedteravaks ajanud. Poola ja Ungari rahvuslikud valitsused vaidlustasid migrantide laialipaigutamise kvoodisüsteemi. Neli riiki leiavad, et nende vastutus seoses üle mere tulevate ebaseaduslike migrantidega on uues rände- ja varjupaigaleppes küll selge, kuid teiste liikmesriikide kohustused mitte. Kreeka, Itaalia, Malta ja Hispaania on seisukohal, et “kohustuslik ümberpaigutamine peaks jääma põhiliseks solidaarsusvahendiks”. Arvestades, et osa peamiselt Ida-Euroopa liikmesriike ei nõustu kohustusliku ümberpaigutamisega, näeb uus rändelepe ette erinevad valikud. Osa riike võtab sisserändajaid vastu, aga teised panustavad rahalise ja logistika-alase toetusega. Ka Eesti on lubanud viimast varianti ja see on täiesti õiglane – pigem panustada tõrjumisse ja tagasisaatmisesse kui vastuvõtule, sest EL-i poliitika tähendab sisuliselt vastuvõttu – kui migrant on siia jõudnud, on võimalused neid tagasi saata väga väikesed. Samal ajal tõhustatakse piiriüleseid eelkontrolli protseduure majandusmigrantide peatamiseks ja kodumaale tagasisaatmiseks. Reformi alusel peatatakse migrandid Euroopa välispiiril, kus teostatud kontrolli järel otsustatakse kas alustada varjupaigaprotseduuri või saabunu välja saata, vahendab BNS. Eesliiniriigid pelgavad, et mõte piirialadel kinnipidamiskeskuste rajamisest saabujate eelkontrolliks ei ole teostatav ega kooskõlas inimõiguste ja rahvusvahelise varjupaigaõigusega. Rändeleppe tekst avalikustati septembris ning läbirääkimistele liikmesriikide ja Euroopa Parlamendi liikmete vahel võib kuluda kuid, halvemal juhul aastaid. Saksamaa on eesistujana kinnitanud, et tahab jõuda kokkuleppele selle aasta lõpuks. Kõik neli Vahemere riiki võtavad endiselt migrante vastu, kusjuures Itaalia vasakvalitsus loobus endise siseministri Matteo Salvini väga efektiivsest rändepiiramispoliitikast. Ka Hispaanias eelmisel aastal võimule tulnud sotsialistide valitsus loobus karmist migratsioonipoliitikast, lubades migrante enda juures maabuda. Kreeka tegutseb rände vastu ülijõuetult. Frontex aga on muutunud sisuliselt vastuvõtuorganisatsiooniks, sest nende kohustuseks on ebaseaduslik ränne fikseerida, kuid samas vastu võtta. (AFP – AP – BNS-UU) ",Uued Uudised,2020-11-27,https://uueduudised.ee/uudis/maailm/migrante-lahkelt-enda-maale-lubavad-louna-euroopa-riigid-nouavad-endiselt-randekvoote/
Vahe Soome valitsuspartei ja Põlissoomlaste toetuses on kõigest üks protsent - Uued Uudised,"Soomes on endiselt kõige populaarsem peaminister Sanna Marini Sotsiaaldemokraatlik Partei (SDP), kuid Põlissoomlased hingavad neile kuklasse, selgus kolmapäeval ajalehe Helsingin Sanomat värskest küsitlusest. Sotsiaaldemokraatlikku erakonda toetab 20,8 protsenti ja parteid Põlissoomlased 19,8 protsenti vastanutest. Kolmandal positsioonil on opositsioonierakond Koonderakond (Kokoomus) 16,5 ja neljandal Keskerakond (Keskusta) 11,7 protsendiga.Viiendal kohal on rohelised 11,1 toetusprotsendiga. Küsitluse viis läbi uuringufirma Kantar TNS ja selles osales rohkem kui 2600 inimest. (STT-BNS) ",Uued Uudised,2020-11-25,https://uueduudised.ee/uudis/maailm/vahe-soome-valitsuspartei-ja-polissoomlaste-toetuses-on-koigest-uks-protsent/
Rändepaktiviljad: Prantsusmaa politsei ajas laiali järjekordse migrandilaagri Pariisi kesklinnas - Uued Uudised,"Kuigi Euroopa Komisjon jätkab rändeprotsesside turgutamist, näitavad reaalsed sündmused, et Euroopasse kuhjunud rändlejad tekitavad ainult probleeme ja riigid ei oska nendega midagi peale hakata. Prantsusmaa politsei ajas esmaspäeval pisargaasi kasutades laiali äsja rajatud migrandilaagri pealinna Pariisi kesklinnas, teatasid meediakanalid. Vabatahtlikud olid aidanud esmaspäeva hilisõhtul pealinna südames püstitada umbes 500 sinist telki, mille täitsid kiiresti migrandid, kellest enamus Afganistanist. Umbes tunni aja pärast saabus politsei laagrit lammutama ja telke kokku korjama. Prantsusmaa on asunud migratsiooniprotsessekontrollima, kuid tõenäoliselt teeb president Macron seda suuresti vaid seetõttu, et mitte lasta konservatiive võimule. Tegelikkuses aga jõuavad migrandid endiselt Pariisi, olles selle muutnud romantikalinnastmigratsioonimülkaks. (BNS-UU) ",Uued Uudised,2020-11-24,https://uueduudised.ee/uudis/maailm/randepakti-viljad-prantsusmaa-politsei-ajas-laiali-jarjekordse-migrandilaagri-pariisi-kesklinnas/
