title,text,subject,date,link
Eesti loodab Covid-19 massvaktsineerimist alustada 2021. aasta esimeses pooles | Telegram,"Samal ajal kui väidetava koroonapandeemia ja PCR-testide suhtes esineb suuri vasturääkivusi, kiirustatakse ülemaailmselt algatama Covid-19 vaktsineerimiskampaaniat. Mitte ükski vaktsiin pole veel viimase staadiumi katseid läbinud, kuid Eesti valitsus on eeltellimuse juba teinud ning loodab laialdast vaktsineerimist alustada 2021. aasta esimeses või teises kvartalis. Saksamaa terviseministri sõnul võivad esimesed vaktsiinid saabuda talvel ning massvaktsineerimist teostatakse tõenäoliselt suurtes näitusesaalides, kus on vaktsiinide hoiustamiseks sobivam temperatuur.    Postimees kirjutas, et valitsus on eraldanud Euroopa Liidu Covid-19 vaktsiinide eelostulepingute finantseerimiseks 1,5 miljonit eurot. Sotsiaalminister Tanel Kiige sõnul plaanitakse esmajärjekorras ära vaktsineerida riskirühmad ja eesliinitöötajad ning hiljem teha vaktsiin tervele elanikkonnale tasuta kättesaadavaks. Toome välja põhilised punktid:  Kui AstraZeneca saab vaktsiini valmis, siis Eesti on taotlenud sealt 1,33 miljonit doosi. Arvestus käib niimoodi, et ühe elaniku kohta on vaja kahte doosi ehk see kogus on piisav poole Eesti elanikkonna vaktsineerimiseks.  Üks doos ei taga esialgsete katsete põhjal püsivat immuunsust. Võimalik, et hilisemas faasis, kui arendustöö jätkub, piisab ka ühest doosist. Eelisjärjekorras on krooniliselt haiged, riskirühmad ja eesliinitöötajad (tervishoiuvaldkonna töötajad, sotsiaaltöötajad ja turvalisuse valdkonna töötajad). Valitsuse töötajad eesliinitöötajate hulka ei kuulu, seega nemad vaktsineerimisnimekirja eesotsas ei ole. Vaktsineerimine hakkab olema vabatahtlik. Väidetavalt on vaktsiinist huvitatud umbes 50–60 protsenti Eesti elanikkonnast, seega esialgu tuleb saadavale poole elanikkonna jagu doose, kuid hiljem soetatakse vaktsiine juurde, et vaktsiin oleks kättesaadav kõigile elanikele.  Samasugusel tehnoloogial põhinev vaktsiin ei pruugi sobida ühtviisi nii nooremale kui ka eakale osale elanikkonnast, ega tervele kui ka kroonilise haiguse kandjale. Kuna valitsus soovib tagada kõigile ühiskonnagruppidele sobiva vaktsiini,  plaanitakse vaktsiine tellida erinevatelt tootjatelt.  Laialdase vaktsineerimisega plaanitakse alustada kõige varem järgmise aasta esimeses kvartalis, võib-olla alles teises kvartalis, aga kindlasti mitte lähikuudel. Kui arvestatav osa elanikkonnast on vaktsineeritud, annab see võimaluse leevendada kehtivad viirustõrjepiiranguid. See sõltub sellest, kui püsiv on vaktsiini tagatud immuunsus ja kui suur osa elanikkonnast on sellega kaetud.  Mitmed riigid, sh USA ja Suurbritannia, on teatanud ka, et vajadusel kasutatakse vaktsineerimiste teostamiseks sõjaväe abi. Lõpetuseks tuletame meelde, et 2009. aasta seagripipandeemiaga seoses läks 2011. aasta sügisel Eestis aegumise tõttu hävitamisele 70 000 doosi seagripi H1N1 vaktsiini nimega Pandremix. Euroopa ravimiamet (EMA) teatas 2011 suvel, et Pandemrix võib põhjustada narkolpesiat ning selle tõttu tuleks selle kasutamist piirata. Sama vaktsiini tõttu on mitmed valitsused maksnud vaktsineerimiskahjustuste eest kompensatsioone (nt Suurbritannias, Norras ja Soomes ning ka Rootsi on tunnistanud Pandemrixi ja narkolepsia seost).   Allikad: Postimees, NTV, lingid artikli sees Foto: cottonbro / Pexels   Toimetas Madis Mark",Telegram,2020-10-05T19:11:53+02:00,https://www.telegram.ee/eesti/eesti-loodab-covid-19-massvaktsineerimist-alustada-2021-aasta-esimeses-pooles
Kahe lapse ema: Kodukool on täiega lahe! | Telegram,"“Meie kodukooli kogemus on praegu saanud kesta juba kolm nädalat, kuna meil hakkas isolatsioon reisi tõttu varem. See aeg on olnud väga lahe kogemus. Ma kujutan ette, kuidas paljudel selle peale kulm kortsu läheb, aga võib-olla on midagi, mis sa saad siit inspiratsiooniks, et teie pere kogemus ka positiivsemaks läheks,” kirjutab Telegramile kahe lapse ema ja loodusravi terapeut Merle Martinson.   Ma olen kirjeldamatult tänulik meie koolile, kes sügisel kutsus lapsevanematele hariduspsühholoogi Grete Arro rääkima sellest, kuidas on üldse hea õppida ning sellest muutus kogu minu suhtumine õppimisse kardinaalselt. Tänu neile tarkustele on vähenenud õppimisele kuluv aeg vähemalt poole võrra ja asjad on püsivamalt meeles. Kui teha midagi efektiivselt ja loodusega kooskõlas, siis hakkabki kergem.   Tuupimine vs õppimine Praegusel ajal on meil õppimise süsteem pigem üles ehitatud tuupimisele, mis kasutab lühimälu ehk kogu tarkus kaob peast kohe, kui kontrolltöö või õpitu vastamine on seljataga. Ma usun, et paljud on kogenud seda, et hiljem enam õpitut ei mäleta ja peavad seda loomulikuks. Ajumaht aga on piiramatu ja laseb meil ka piiramatus koguses informatsiooni ammutada. Selle süsteemi kõige suurem miinus on see, et me vajame tegelikult varasemaid teadmisi selleks, et ehitada uusi. Ehk õppimine on nagu maja ehitamine. Kui koguda teadmisi lühimälusse, kus need pidevalt kustuvad, siis vundament on habras ja tahes-tahtmata hakkavad „maja“ seinad ühel hetkel mõranema ning tekivad õpiraskused ehk ülioluline on talletada õpitu püsimälusse. Kogu asja juures on naljakas see, et nii on kergem õppida, kui tundide viisi tuupides: miinimumpanus ja maksimumtulemus – suurepärane ju.   Kriisiolukord loksutab paljud asjad paika Grete Arro alustas loengut küsimusega: mis on õppimine? Tänases hinnete-süsteemi koolimaailmas on kahjuks nii, et kiidetakse ja viisi jagatakse nendele õpilastele, kes ei õpi enam midagi. Pole väljakutseid! Neilt õpilastelt peab hoopis nende aja raiskamise eest vabandust paluma. Samas karistatakse kahtedega neid, kes õpivad ja kes pole veel seda oskust omandanud – uskuge mind, hinne „kaks“ ei motiveeri kedagi õppima. Mõelge, mis teid tööl motiveerib, ma olen kindel, et ülemuse pidev kritiseerimine see kindlasti ei ole. Lahe oli kuulda teadlase suust, et hinded on rämpsmotivatsioon ja neid ei tohiks panna. Seetõttu oli omamoodi põnev selle nädala alguse uudis, et haridusministeerium on välja saatnud juhised, milles on kirjas, et kedagi numbriliselt hinnata ei tohi ja toimub vaid kujundav hindamine. On õpetlik kogeda, et kriisiolukord loksutab nii paljut õiges suunas liikuma ning nüüd, mil kogu riigi õpetajad peavad omandama uue oskuse, loodan, et hiljem iganenud süsteemi tagasi ei minda. Loodan, et paljud hakkavad ka rõõmuga suhtuma sellesse, kui ajul on raske ega püüa selle raskustunde eest kiiresti põgeneda või last säästa, vaid saavadki aru, et see ongi õppimine. Mul endal kogu Arro loengu aja aju lausa kärssas, füüsiliselt oli valus, sest seni teatu pöörati pahempidi, aga esimest korda elus ei tundnud ma end selles olukorras end rumalana, vaid teadsin, et ajus käib tugev õppeprotsess.   Kuidas talletada õpitu püsimälusse Aju on nagu ülejäänud keha – kui teha trenni ja ta proovile panna, siis ta muutub tugevaks. Tuupimise asemel on mõistlik õppida sutsakutega. Kõigepealt võtad õpitava materjali ning töötad läbi, luues eelnevate teadmistega seosed. Nagu kooks kampsunit. Hea on veel leida erinevaid seoseid, et erinevaid teid pidi oleks hiljem info ajust kättesaadav. Need seosed ei pea alati olema loogilised, võib kasutada midagi isiklikku enda elust. Ma arvan, et paljud on mõne ajaloofakti hoopis enda sünnipäeva või suurema sündmusega ühildanud. Kui põhjalik seoste leidmise töö on ära tehtud, jäta materjalid rahule. Võta ette midagi muud, mine tee sporti ja tule hiljem õppimise juurde tagasi. Esimese asjana proovi niipalju kui võimalik peast meenutada. See on see koht, kus aju läheb stressi selles maailma kõige paremas mõttes: minult küsitakse seda, ma pean seda teadma ning sellel hetkel hakkab kõige usinam püsiühenduste ehitamine. Kui sekundipealt meelde ei tule, siis anna ajule aega kaevata. Ära haara kergekäeliselt vihikut või õpikut. Kui meenutustöö tehtud, saad teksti taas läbi töötada ning need osad, mis meelde ei jäänud, üle vaadata. Seejärel jäta materjal jälle paremat aega ootama ning selle juurde tagasi tulles püüa samamoodi nii palju kui võimalik ainult mälust õpitut meenutada. Üldjuhul kolmas kord on juba enamik teadmistest kenasti olemas.   Teadmiste kontroll on iseenda jaoks Teadustööde põhjal said testidest paremad tulemused need, kes kasvõi üks kord olid korralikult seoseid luues materjali läbi töötanud, mitte need, kes õhtu läbi tuupimisega tegelesid. Arro sõnul on kõige ebaotstarbekam see, kui inimene enne testi vihiku lahti teeb ja õpitu üle kordab, sellega tõstab ta enda teadmised kõik lühimälusse. Testimist peaks tema sõnul tegema aga palju ja kogu aeg, aga neid ei tohiks hinnata. Teadmiste kontroll on vaid iseenda jaoks, et aju heas mõttes stressis hoida – minult võidakse iga hetk seda küsida. Muidugi hakkavad paljud nüüd vastu vaidlema, et kui pole hindeid, ei tee keegi midagi. Meie põlvkond on üles kasvatatud piitsa ja präänikuga. See on loonud olukorra, kus inimene kas väldib piitsa või püüab präänikut ning kõik vahepealne on laiskus, sest keegi ei sunni. See on inimese enda loodud tehislik süsteem, kus keegi peab kogu aeg tugevam pool olema ja sundima – nii ei teki enesedistsipliini, koostööd. Tänapäeval on teadlased ammu sellise lähenemise ümber lükanud ja õpetatakse koostööd, sest meil on sisemine tung õppida, olla head lapsed, head täiskasvanud ning kui meid ei ole õpetatud iga asja eest head või halba tasu saama, siis teeme kõike rõõmuga. Ka õpetajalt ja lapsevanemalt nõuab koostöö palju vähem energiat ja aega. Jälle üks suurepärane asi, kus loodusega käsikäes toimetades on asjad lihtsamad – nagu ikka siin elus. Tasub uurida ka ägeda Eesti mehe Tanel Jäppineni tegemisi, kes on võtnud südameasjaks aidata Eesti lapsevanemaid hea partnerlussuhte loomisel perekonnas.   Õppimisel on oluline kvaliteet, mitte kvantiteet Kui nüüd tulla konkreetselt meie kodukooli kogemuse juurde, siis rakendades Arro loengus õpitut, on ajakulu hoopis teine. Me keskendume rohkem nendele asjadele, mida me veel ei oska ning vähem nendele, mis tulevad kergusega ning raiskavad pigem aega. Õppimise juures on oluline kvaliteet, mitte kvantiteet. Mul on väga hea meel lugeda meie õpetaja meile, sest tema tundub olevat samal lainel. Maailmas on kahjuks ka negatiivseid näiteid, kus Itaalias on õpetajad pigem kvantiteedi peale välja läinud, et aega sisustada. Praegu aga oleks võimalus tegelikult graafikust ette minna, kui targalt toimetada. Tänu vähesele ajakulule on meil võimalik juurde võtta õppeaineid, mis meil üldse veel kavas pole. Ma saan ise lastele juurde teha ülesandeid, mille puhul ma näen, et nad veel tugevad ei ole, ning samuti, mis olulisim – ei mingit stressi. Stressiolukorras on ajul vaid kolm funktsiooni – põgene, tardu, võitle. Loogiline mõtlemine ei toimi. Kõik on tegelikult hästi. Ei pea olema kõik maksimaalne, vaid lihtsalt igaüks peaks andma enda hetke parima. Meil on kogu maailm pahempidi keeratud ja kellegagi ei juhtu midagi, kui kõik ei ole ideaalne. Lapsed ei jää rumalaks, vaid saavad õppida veel laiahaardelisemalt, kui aega õigesti kasutada. Lapsed saavad õppida just nii, nagu neil kõige parem on ja neid juhendatakse personaalselt – see on ju suurepärane.   Käivitada tuleb loovus, eluks vajalik oskus Ma loodan, et meie õpetajad teavad, et keegi ei oota neilt maksimaalset, sest kõik leiavad uues süsteemis enda süsteemi. Ja selles pole midagi halba. Igaühe sees võiks nüüd pead tõsta selline väike äge eluterve pohhuist, millest Toomas Valsberg enda raamatus räägib. Selline, kes ei lähe pingesse pisiasjadest, keskendub tõesti vaid olulisele ja lihtsalt vaatab, et ta kellelegi liiga ei tee – lihtne, eks. Inimesed saavad uuesti käivitada enda loovust, mille kraanid on täiesti kinni keeratud, aga mis on eluks vajalik oskus. Kodukontor ja kodukool koos on muidugi omaette väljakutse ja siin ma näen, et paljudel on keeruline: lapsed jooksevad kogu aeg loengu pulti, tulevad küsima midagi, ei lase töötada. Nüüd, mil suur osa Eesti inimesi on üle läinud arvutipõhisele töötamisele, võiks selline elukorraldus olla normaalsus. Lapsed on normaalne elu osa ja ma olen juba aastaid teinud niimoodi tööd, et nad on minu kõrval. Vahel nad küsivad midagi ja ma vastan. Loengut andes olen ka rinda andnud beebile korduvalt. Keegi ei pane seda pahaks – pigem loob see mõnusat vabaduse tunnet juurdegi ja võtab maha pingeid. Pingevaba keskkond aga omakorda loob paremaid töötulemusi.   Koroonaviiruse helgem pool Meil on hea eeskuju haridusminister Mailis Repsi näol, kes beebiga rahulikult oma tööd on teinud. Vägev lihtsalt! Hetkeolukord sunnib meid parandama kiirelt kõike seda, mille osas me oleme normaalse elu teelt kõrvale kaldunud. Kes ei oska loodusraviga end toetada, siis sellel on õige hetk õppida seda tegema. Õpetajad peavad kiirelt õppima kujundavat hindamist, millele üleminek muidu käib ühiskonnas ju juba ammu, aga sujub visalt. Inimesed peavad ise vastutama oma töö eest, keegi ei peagi kuklasse hingama ning ehk suudab tööandja ka hiljem vabaks lasta selle kontrollivajaduse ning avastab, et ei peagi kalleid kesklinna büroosid rentima, vaid saab töötajale hoopis parema palga võimaldada. Inimesed käivad looduses, sest see on koht, kus on piisav distants, ja samas toetavad enda tervist maailma parimal moel. Suhted perekonnas peab korda tegema nüüd ja kohe, sest koos istudes on hea läbisaamine kohustuslik ellujäämise oskus. See kõik on imeline! Pole ühtegi halba asja ilma heata. Aitäh nende ägedate asjade eest, mille koroona on meie elus muutnud, näidates ka asja positiivsemat poolt.   Merle Martinson   Foto:",Telegram,2020-03-22T08:34:37+02:00,https://www.telegram.ee/arvamus/kahe-lapse-ema-kodukool-on-taiega-lahe
Nõuandeid digisõltuvuse vältimiseks ja koduse aja positiivseks kasutamiseks | Telegram,"Kuidas kodus istudes vältida digisõltuvust? Abiks on alljärgnev kokkuvõtte Game Quittersi esindaja Cam Adairi ja pereterapeudi Nadja Streiteri videokõnest “Nutiseadmete kasutamine tervisekriisi ajal: nõuanded perekonnale“.  Game Quitters on ettevõte ja kogukond, mis aitab mänguritel videomängusõltuvusest üle saada ja luua perekonnas suuremat mõistmist ja harmooniat tehnoloogia kasutamise osas.   Mõistagi on see väga intensiivne muutusterohke aeg. Lapsed on koduõppel, samal ajal peavad paljud vanemad tegema kaugtööd. Me peame oskama nende muutustega toime tulema, eriti mis puudutab tehnoloogia kasutamist. Selline kriis aitab näha tehnoloogia head külge. Meil on võimalus püsida maailmaga ühenduses ja kodus töötada või õppida. Kui tehnoloogiat positiivsel viisil kasutada, on see väga kasulik.  Kuid nutiseadmete kasutamine võib minna ka üle piiri. Leebemad reeglid võivad praegusel ajal olla mõistetavad, kuid see ei tähenda vabadust mängida päevad läbi videomänge. Kvantiteedi asemel me soovime keskenduda kvaliteedile. Me veedame nutiseadmetes paratamatult rohkem aega, kuid me soovime seda aega võimalikult produktiivselt kasutada.  Kuidas juhtida nutiseadmete kasutust koroonaviiruse kriisi ajal? Millele tähelepanu pöörata? Kui palju on liiga palju? Kuidas luua plaani? Siin on mõned praktilised nõuanded.   ANNA KRIISILE POSITIIVNE TÄHENDUS Tegemist on küll kriisiga, kuid selle tasub ümber sõnastada ka võimaluseks.  Alguses on see kindlasti harjumatu ja keeruline, kuid me suudame need algsed probleemid üsna kiirelt ületada, sest inimesed on kohanemisvõimelised. Seega vaatame seda kriisi kui võimalust. Me teame, et perekonnad veedavad koos palju rohkem aega kui tavaliselt. Kuidas me saaksime kasutada seda võimalust, et üksteisega taaskord ühenduda, teineteist rohkem tundma õppida, elada koos ilma konfliktideta ja hõlpsama kommunikatsiooniga? See on oluline aeg tuvastamiseks, millised on meie individuaalsed vajadused, kuidas me saaksime neid kommunikeerida ja kuidas me saaksime koos plaani luua. Me võime olla koos karantiinis, kuid me võime töötada koos viisil, mis ei too kaasa üleliigset stressi. Seda on juba niigi piisavalt. Nii et kuidas me saaksime elada suuremas harmoonias? Aeg-ajalt vajavad inimesed privaatset aega, kuid samuti me tuleme kokku, sest tunneme sel perioodil üksindust. Me ei saa nii palju enam välja minna, me oleme rohkem eraldatud. Me peame tõsiselt järele mõtlema, kuidas me saame oma sotsiaalseid vajadusi täita ja rohkem ühenduses olla. On üks lugu ühest perekonnast, kes sattus väga varakult karantiini, umbes kuu või kaks tagasi. Selle aja jooksul polnud neil tehnoloogiale ligipääsu ja kõik olid alguses üsna ärevil, kuid nad avastasid lõpuks, et neile tõeliselt meeldis üksteisega rohkem aega veeta ja teineteist tundma õppida.   VAATA ÜLE OMA HARJUMUSED Kuna tegemist on tervisekriisiga, on see suurepärane aeg, et vaadata üle oma terviseharjumused – mitte vaid seoses füüsilise tervisega, kuid ka vaimse tervise ja heaoluga. Kui püüame stressi maandada, siis on teadusringkondade poolt üsna selgelt kinnitatud, et mindfulness ja meditatsioon aitab vähendada nii ärevust kui stressi. Meil on käeulatuses võrratud äpid, mis aitavad meil praktiseerida teadlikku hingamist või joogat. Paljud organisatsioonid on teinud oma materjalid tasuta kättesaadavaks, et inimesi sellel ajal toetada. Sa võid samuti nihutada oma fookust ja tunnistada, et lastele meeldib YouTube – seega kuidas me saame kasutada YouTube-i positiivsel viisil? Õppige näiteks joonistamist või harjutage uut keelt. Kui majas vedeleb vana pill, siis võtke see kätte. Tehnoloogia abil on võimalik peaaegu kõike õppida. Digiseadmete kasutamisaja vähendamine ei pruugi olla hetkel teostatav, kuid sellisel juhul keskendu kvaliteedile.   TUGEV PERERUTIIN – TEGEVUSED, MIS LOOVAD ÜHENDUST JA KINDLUST Meil on vaja viise, kuidas aega veeta ja igavust peletada, ning üks viis selle teostamiseks on lõputult Netflixi vaadata, Facebookis uudistevoogu allapoole kerida või päevad läbi arvutimänge mängida ja loota, et see kõik möödub. Teiseks lähenemiseks on luua tugev rutiin, mis hõlmab endas ajajuppe, mil sa teed tegevusi, mis aitavad produktiivselt aega veeta. See on asjade prioritiseerimine ja tuvastamine, mis on kõige olulisem. Seega leidke võimalusi, kuidas kogu perekond nendes tegevustes osaleda saaks. Kui teil on olnud suhtlemisraskuseid, siis erinevate tegevuste leidmine aitab teil luua sügavamat ühendust nii, et te pole samal ajal sunnitud rääkima ega üleliigset survet tundma. Kui mängite lauamängu, võite ükskõik millistest elulistest asjadest rääkida, kuid samas võite ka lihtsalt mängust rääkida. Samuti on rutiini loomine oluline selleks, et tunneksite oma elus kindlust, eriti sellisel teadmatust ja ebakindlust täis perioodil. Seega me peame leidma viise, kuidas luua struktuuri. See võib koosneda ühisest söögitegemisest, koristamisest, vanade perekonnavideode vaatamisest või kokkuleppest, et kui ema ja isa teevad kaugtööd, on lapsed samal ajal kodutöid tegemas. Leidke see tasakaal koostegutsemise ja isikliku aja vahel. Oleks hea, kui terve perekond saaks selle plaani loomisest osa võtta ja kuuldav olla. Lastel peab olema selge, mida igalt päevalt oodata ja millega arvestada, kuid kui mainite majapidamistöid või muid kohustusi, siis tasub kasutada positiivsemat väljendit nagu oskuste arendamine. Kõik need tegevused on võimalused, et õppida uusi oskuseid!   MIS ON NEED TEGEVUSED, MIDA OLED ALATI TEHA SOOVINUD? Mine oma mõtetes tagasi ja küsi: „Millised olid need tegevused, mida ma lubasin teha, kui mul on rohkem aega?“ Nüüd on see aeg kätte jõudnud! Meil on aega, et teha asju, mille jaoks meil varem aega polnud. See on suurepärane viis, kuidas sellele momendile uue tähenduse anda. Karantiinis olemine võtab aja maha. See on võimalus tõeliselt emmata seda rahu, vaikust, aeglustust. Paljud on selle järele küsinud. Me oleme pidevalt soovinud, et asjad aeglustuksid. Me oleme soovinud teha vähem tööd. Nüüd on meil see võimalus. Me ei kujutanud ette, et see sellisel viisil kätte saabub, kuid nüüd on see siin. Nii et kuidas saaksime selle vastu võtta?   EESKUJU: KUIDAS KASUTAD TEHNOLOOGIAT LAPSEVANEMANA? On väga oluline, et oleksid lapsevanemana eeskuju selles osas, kuidas sa tarbid uudiseid ja omandad informatsiooni, mida sul praegusel ajal vaja läheb. Muidugi on oluline jälgida muutuseid, et sinu perekond oleks kaitstud, kuid sellisel viisil, et sa ei satuks paanikasse või tarbimislõksu. See, kuidas sa praegusel ajal tehnoloogiat kasutad, näitab palju sinu perekonnale ja lastele. Sa sead eeskuju, seega mida sihilikum on sinu nutiseadmete kasutamine, seda rohkem saad oma käitumist standardina esitada. Kui sa palud oma lastelt, et nad ei oleks pidevalt ekraani taga, kuid sina oled, näevad nad seda topeltstandardina ja see põhjustab paratamatult konflikte. Seega kasuta seda võimalust, et leida ka enda jaoks uusi hobisid ja rutiine. Kasuta tehnoloogiat viisil, mis oleks abistav ja aitaks sul tunda ennast paremini. Meil kõigil on võimalus olla vastutustundlik ühiskonnaliige ja anda endast oma parim. Ja see algab sellest, kuidas me toimime oma kodus.   Allikas: Game Quitters Youtube Foto: Andrea Piacquadio / Pexels   Toimetas Madis Mark",Telegram,2020-03-19T16:00:18+02:00,https://www.telegram.ee/teadus-ja-tulevik/nouandeid-digisoltuvuse-valtimiseks-ja-koduse-aja-positiivseks-kasutamiseks
